{
  "sls_id": "sls:lex:000125",
  "word": "sonkor",
  "part_of_speech": "magac",
  "gender": "feminine",
  "plural": null,
  "dialect": "so",
  "definitions": [
    {
      "sense": 1,
      "en": "sugar",
      "so_gloss": "walax macaan"
    }
  ],
  "is_loanword": null,
  "metadata": {
    "contributor": "SLS maintainers",
    "source": "Synthetic schema fixture exercising nullable reviewed fields",
    "date_added": "2026-09-04",
    "review_status": "draft",
    "license": "CC BY 4.0",
    "schema_version": "1.1.0"
  }
}
